{
  "schema_version": 1,
  "decision_id": "D-FAE-001",
  "type": "approval",
  "status": "approved",
  "requested_by": "architecture-coordinator",
  "prompt": "是否批准 FAE-001 Dispatch 词汇与边界定义，并按 /plan 调度 Phase 0？",
  "options": [
    "approve",
    "revise",
    "reject"
  ],
  "selected_option": "approve",
  "resolved_by": "interactive-user",
  "resolved_at": "2026-07-26T13:29:41.660Z",
  "rationale": "用户确认仅批准 FAE-001，并按 /plan 调度；不扩展到 FAE-002～FAE-006。",
  "gate": {
    "action": "architecture",
    "resource_ref": "proposal:.agent/plans/proposals/projects/full-automation-evolution/proposals/FAE-001-dispatch-vocabulary.md@da93dd0f7e1b3115f5de9c6404201e854fe53d90b332e07f3ba218561a43b137"
  },
  "task_id": null,
  "mission_id": null,
  "superseded_by_decision_id": null,
  "created_at": "2026-07-26T13:29:41.044Z",
  "updated_at": "2026-07-26T13:29:41.660Z"
}
